username;date;retweets;favorites;text;geo;mentions;hashtags;id;permalink
realDonaldTrump;2017-09-26 18:43;8560;39849;"It was an honor to welcome President @MarianoraJoy of Spain. Thank you for standing w/ us in our efforts to isolate the brutal #NoKo regime. pic.twitter.com/43U4T34JgF";;@MarianoraJoy;#NoKo;"912809860965613568";https://twitter.com/realDonaldTrump/status/912809860965613568
realDonaldTrump;2017-09-26 18:32;8690;47275;"I want to express our support and extend our prayers to all those affected by the vile terror attack in Spain last month. pic.twitter.com/5mT0QXFlnL";;;;"912807096885723137";https://twitter.com/realDonaldTrump/status/912807096885723137
realDonaldTrump;2017-09-26 17:34;10642;46974;"America's hearts & prayers are with the people of #PuertoRico & the #USVI . We will get through this - and we will get through this TOGETHER! pic.twitter.com/NcmsF4Fqpr";;;#PuertoRico #USVI;"912792478096302080";https://twitter.com/realDonaldTrump/status/912792478096302080
realDonaldTrump;2017-09-26 16:43;6999;43788;"Heading over to the @UN to meet with Ambassador @NikkiHaley and all of her great representatives! #USA";;@UN @NikkiHaley;#USA;"912779672257261569";https://twitter.com/realDonaldTrump/status/912779672257261569
realDonaldTrump;2017-09-26 12:13;7011;38169;"Honored to welcome Republican and Democrat members of the House Ways and Means Committee to the White House today! #USA pic.twitter.com/nWnX9CDP0d";;;#USA;"912711807709667331";https://twitter.com/realDonaldTrump/status/912711807709667331
realDonaldTrump;2017-09-26 09:06;19713;89344;"The NFL has all sorts of rules and regulations. The only way out for them is to set a rule that you can't kneel during our National Anthem!";;;;"912664574461120512";https://twitter.com/realDonaldTrump/status/912664574461120512
realDonaldTrump;2017-09-26 08:13;14095;67777;"Thank you to Carmen Yulin Cruz, the Mayor of San Juan, for your kind words on FEMA etc.We are working hard. Much food and water there/on way";;;;"912651215997202432";https://twitter.com/realDonaldTrump/status/912651215997202432
realDonaldTrump;2017-09-26 07:14;12489;50273;"Great interview on @foxandfriends with the parents of Otto Warmbier: 1994 - 2017. Otto was tortured beyond belief by North Korea.";;@foxandfriends;;"912636538156146688";https://twitter.com/realDonaldTrump/status/912636538156146688
realDonaldTrump;2017-09-26 06:47;15267;85978;"But while Dallas dropped to its knees as a team, they all stood up for our National Anthem. Big progress being made-we all love our country!";;;;"912629775629418501";https://twitter.com/realDonaldTrump/status/912629775629418501