username;date;retweets;favorites;text;geo;mentions;hashtags;id;permalink
realDonaldTrump;2017-10-19 08:21;14292;43377;". @foxandfriends "Russia sent millions to Clinton Foundation"";;@foxandfriends;;"920988223362469891";https://twitter.com/realDonaldTrump/status/920988223362469891
realDonaldTrump;2017-10-19 07:56;15702;51891;"Workers of firm involved with the discredited and Fake Dossier take the 5th. Who paid for it, Russia, the FBI or the Dems (or all)?";;;;"920981920787386368";https://twitter.com/realDonaldTrump/status/920981920787386368
realDonaldTrump;2017-10-19 07:17;26131;76232;"Uranium deal to Russia, with Clinton help and Obama Administration knowledge, is the biggest story that Fake Media doesn't want to follow!";;;;"920972261032648705";https://twitter.com/realDonaldTrump/status/920972261032648705
realDonaldTrump;2017-10-19 06:54;10348;50423;"Republicans are going for the big Budget approval today, first step toward massive tax cuts. I think we have the votes, but who knows?";;;;"920966294035451904";https://twitter.com/realDonaldTrump/status/920966294035451904
realDonaldTrump;2017-10-18 23:03;15410;65507;""46% of Americans think the Media is inventing stories about Trump & his Administration." @FoxNews It is actually much worse than this!";;@FoxNews;;"920847844759699456";https://twitter.com/realDonaldTrump/status/920847844759699456
realDonaldTrump;2017-10-18 19:31;8527;35012;". @DanaPerino & @BradThor , Thank you so much for the wonderful compliment. Working hard! #MAGA pic.twitter.com/AKWlsMsCVH";;@DanaPerino @BradThor;#MAGA;"920794597265088512";https://twitter.com/realDonaldTrump/status/920794597265088512
realDonaldTrump;2017-10-18 18:49;12091;47371;""20,000 21,000 22,000 23,000 this year...FOUR one thousand milestones this year..." #Dow23K #MAGA pic.twitter.com/GQ5f2eVvEI";;;#Dow23K #MAGA;"920783976784171008";https://twitter.com/realDonaldTrump/status/920783976784171008
realDonaldTrump;2017-10-18 18:19;15216;58057;"This is what REAL PRIDE in our COUNTRY is all about! #USA pic.twitter.com/kyv866prdE";;;#USA;"920776302231244800";https://twitter.com/realDonaldTrump/status/920776302231244800
realDonaldTrump;2017-10-18 16:42;20428;86140;". @NFL : Too much talk, not enough action. Stand for the National Anthem.";;@NFL;;"920751863426842625";https://twitter.com/realDonaldTrump/status/920751863426842625
realDonaldTrump;2017-10-18 15:27;10385;35521;""Iran hides behind its assertion of technical compliance w/the nuclear deal, while it brazenly violates the other limits.." Amb. @NikkiHaley pic.twitter.com/xvHgx7d1cT";;@NikkiHaley;;"920733077349064707";https://twitter.com/realDonaldTrump/status/920733077349064707
realDonaldTrump;2017-10-18 14:20;6714;31304;"It was an honor to welcome Republican and Democratic members of the Senate Finance Committee to the @WhiteHouse today. #TaxReform pic.twitter.com/ge4Xic9fId";;@WhiteHouse;#TaxReform;"920716270395371521";https://twitter.com/realDonaldTrump/status/920716270395371521
realDonaldTrump;2017-10-18 12:58;8235;39033;"Our hearts are with all affected by the wildfires in California. God bless our brave First Responders and @FEMA team. We support you! https:// twitter.com/fema_brock/sta tus/920379939769278464 …";;@FEMA;;"920695565578592256";https://twitter.com/realDonaldTrump/status/920695565578592256
realDonaldTrump;2017-10-18 11:07;9613;38558;"The current tax code is a burden on American taxpayers & harmful to job-creators. Americans need #TaxReform ! More: http:// 45.wh.gov/sTqH9z pic.twitter.com/NGIjJOc3TP";;;#TaxReform;"920667567030710272";https://twitter.com/realDonaldTrump/status/920667567030710272
realDonaldTrump;2017-10-18 09:41;12256;55120;"I am supportive of Lamar as a person & also of the process, but I can never support bailing out ins co's who have made a fortune w/ O'Care.";;;;"920645935981613057";https://twitter.com/realDonaldTrump/status/920645935981613057
realDonaldTrump;2017-10-18 07:25;24302;92858;"Democrat Congresswoman totally fabricated what I said to the wife of a soldier who died in action (and I have proof). Sad!";;;;"920611770775064576";https://twitter.com/realDonaldTrump/status/920611770775064576
realDonaldTrump;2017-10-18 07:06;23084;94334;"The NFL has decided that it will not force players to stand for the playing of our National Anthem. Total disrespect for our great country!";;;;"920606910109356032";https://twitter.com/realDonaldTrump/status/920606910109356032
realDonaldTrump;2017-10-18 06:56;23983;86532;"As it has turned out, James Comey lied and leaked and totally protected Hillary Clinton. He was the best thing that ever happened to her!";;;;"920604520572424193";https://twitter.com/realDonaldTrump/status/920604520572424193
realDonaldTrump;2017-10-18 06:38;13409;55919;"The Democrats will only vote for Tax Increases. Hopefully, all Senate Republicans will vote for the largest Tax Cuts in U.S. history.";;;;"920599916371693568";https://twitter.com/realDonaldTrump/status/920599916371693568
realDonaldTrump;2017-10-18 06:27;18552;67086;"...people not interviewed, including Clinton herself. Comey stated under oath that he didn't do this-obviously a fix? Where is Justice Dept?";;;;"920597192666157057";https://twitter.com/realDonaldTrump/status/920597192666157057
realDonaldTrump;2017-10-18 06:21;23059;78975;"Wow, FBI confirms report that James Comey drafted letter exonerating Crooked Hillary Clinton long before investigation was complete. Many..";;;;"920595564064100352";https://twitter.com/realDonaldTrump/status/920595564064100352
realDonaldTrump;2017-10-17 22:21;16742;59107;"The most important truth our FOUNDERS understood was: FREEDOM is NOT a gift from Govt. FREEDOM is a GIFT from GOD. http:// 45.wh.gov/dfu6M8 pic.twitter.com/SrPavwrt2R";;;;"920474831749025795";https://twitter.com/realDonaldTrump/status/920474831749025795
realDonaldTrump;2017-10-17 20:44;9247;39664;"Thank you @Heritage ! This is our once-in-a-generation opportunity to revitalize our economy, revive our industry & renew the AMERICAN DREAM! pic.twitter.com/HI30nojsGo";;@Heritage;;"920450535005851648";https://twitter.com/realDonaldTrump/status/920450535005851648
realDonaldTrump;2017-10-17 19:06;16502;60182;"WOW! pic.twitter.com/eKfRktNVuy";;;;"920425695507042305";https://twitter.com/realDonaldTrump/status/920425695507042305
realDonaldTrump;2017-10-17 19:03;29377;97186;"BORDER WALL prototypes underway! pic.twitter.com/arFNO80zmO";;;;"920425069964349445";https://twitter.com/realDonaldTrump/status/920425069964349445
realDonaldTrump;2017-10-17 17:56;16253;68825;"Any increase in ObamaCare premiums is the fault of the Democrats for giving us a "product" that never had a chance of working.";;;;"920408108194783232";https://twitter.com/realDonaldTrump/status/920408108194783232
realDonaldTrump;2017-10-17 17:51;15736;61085;"So much Fake News being put in dying magazines and newspapers. Only place worse may be @NBCNews , @CBSNews , @ABC and @CNN . Fiction writers!";;@NBCNews @CBSNews @ABC @CNN;;"920406959320371200";https://twitter.com/realDonaldTrump/status/920406959320371200
realDonaldTrump;2017-10-17 14:59;6497;35288;"It was my great honor to welcome Prime Minister Alexis Tsipras of Greece to the WH today! http:// 45.wh.gov/91vp4k http:// instagram.com/p/BaXBsMYA_dS/ pic.twitter.com/MPe5HWFcZ1";;;;"920363714062274560";https://twitter.com/realDonaldTrump/status/920363714062274560
realDonaldTrump;2017-10-17 13:25;4182;23398;"Join me LIVE from the Rose Garden at 1:30pmE with Prime Minister Alexis Tsipras of Greece. http:// 45.wh.gov/91vp4k pic.twitter.com/dZB4mDBKpi";;;;"920340060947574786";https://twitter.com/realDonaldTrump/status/920340060947574786
realDonaldTrump;2017-10-17 12:16;11215;43971;""Dow Passes 23,000 for the First Time, Fueled by Strong Earnings" #Dow23K http:// 45.wh.gov/Dow23K pic.twitter.com/wlP0NCNcou";;;#Dow23K;"920322631412473856";https://twitter.com/realDonaldTrump/status/920322631412473856
realDonaldTrump;2017-10-17 08:39;8499;47925;"Rep.Tom Marino has informed me that he is withdrawing his name from consideration as drug czar. Tom is a fine man and a great Congressman!";;;;"920268091329859585";https://twitter.com/realDonaldTrump/status/920268091329859585
realDonaldTrump;2017-10-16 19:32;12062;63750;"Always great to see the wonderful people of South Carolina. Thank you for the beautiful welcome at Greenville-Spartanburg Int'l Airport! pic.twitter.com/maO9Nc0sTe";;;;"920069869365878785";https://twitter.com/realDonaldTrump/status/920069869365878785
realDonaldTrump;2017-10-16 09:12;34723;149730;"I was recently asked if Crooked Hillary Clinton is going to run in 2020? My answer was, "I hope so!"";;;;"919914000959397888";https://twitter.com/realDonaldTrump/status/919914000959397888
realDonaldTrump;2017-10-16 08:57;19291;93873;"The U.S. has gained more than 5.2 trillion dollars in Stock Market Value since Election Day! Also, record business enthusiasm.";;;;"919910256624447493";https://twitter.com/realDonaldTrump/status/919910256624447493
realDonaldTrump;2017-10-16 08:54;19861;90401;"Since Election Day on November 8, the Stock Market is up more than 25%, unemployment is at a 17 year low & companies are coming back to U.S.";;;;"919909494200528897";https://twitter.com/realDonaldTrump/status/919909494200528897
realDonaldTrump;2017-10-16 08:49;20570;74803;"Dem Senator Schumer hated the Iran deal made by President Obama, but now that I am involved, he is OK with it. Tell that to Israel, Chuck!";;;;"919908143475412993";https://twitter.com/realDonaldTrump/status/919908143475412993
realDonaldTrump;2017-10-16 08:21;12602;55648;"The Democrats only want to increase taxes and obstruct. That's all they are good at!";;;;"919901190376259586";https://twitter.com/realDonaldTrump/status/919901190376259586
realDonaldTrump;2017-10-16 08:17;12721;56486;"Art Laffer just said that he doesn't know how a Democrat could vote against the big tax cut/reform bill and live with themselves! @FoxNews";;@FoxNews;;"919900022409449474";https://twitter.com/realDonaldTrump/status/919900022409449474
realDonaldTrump;2017-10-15 09:46;14773;76179;"...approvals of The Keystone XL & Dakota Access pipelines. Also, look at the recent EPA cancelations & our great new Supreme Court Justice!";;;;"919560102725738498";https://twitter.com/realDonaldTrump/status/919560102725738498
realDonaldTrump;2017-10-15 09:25;12749;59740;"The Failing @nytimes , in a story by Peter Baker, should have mentioned the rapid terminations by me of TPP & The Paris Accord & the fast....";;@nytimes;;"919554724512387072";https://twitter.com/realDonaldTrump/status/919554724512387072
realDonaldTrump;2017-10-14 17:27;15849;69996;"The Democrats in the Southwest part of Virginia have been abandoned by their Party. Republican Ed Gillespie will never let you down!";;;;"919313707355787264";https://twitter.com/realDonaldTrump/status/919313707355787264
realDonaldTrump;2017-10-14 07:27;22675;117172;"Very proud of my Executive Order which will allow greatly expanded access and far lower costs for HealthCare. Millions of people benefit!";;;;"919162619889704961";https://twitter.com/realDonaldTrump/status/919162619889704961
realDonaldTrump;2017-10-14 07:18;18330;83320;"Health Insurance stocks, which have gone through the roof during the ObamaCare years, plunged yesterday after I ended their Dems windfall!";;;;"919160558712172544";https://twitter.com/realDonaldTrump/status/919160558712172544
realDonaldTrump;2017-10-13 21:31;15917;67695;"Such a wonderful statement from the great @LouDobbs . "We take up what may be the most accomplished presidency in modern American history."";;@LouDobbs;;"919012714827145216";https://twitter.com/realDonaldTrump/status/919012714827145216
realDonaldTrump;2017-10-13 21:17;12333;60695;"ObamaCare is causing such grief and tragedy for so many. It is being dismantled but in the meantime, premiums & deductibles are way up!";;;;"919009334016856065";https://twitter.com/realDonaldTrump/status/919009334016856065
realDonaldTrump;2017-10-13 21:10;15774;68391;"Money pouring into Insurance Companies profits, under the guise of ObamaCare, is over. They have made a fortune. Dems must get smart & deal!";;;;"919007577681354752";https://twitter.com/realDonaldTrump/status/919007577681354752
realDonaldTrump;2017-10-13 21:02;11264;53863;"Many people talking, with much agreement, on my Iran speech today. Participants in the deal are making lots of money on trade with Iran!";;;;"919005534883328000";https://twitter.com/realDonaldTrump/status/919005534883328000
realDonaldTrump;2017-10-13 20:53;14052;69330;"Starting to develop a much better relationship with Pakistan and its leaders. I want to thank them for their cooperation on many fronts.";;;;"919003314674634752";https://twitter.com/realDonaldTrump/status/919003314674634752
realDonaldTrump;2017-10-13 18:01;10580;40942;"#WeeklyAddress pic.twitter.com/riqEiBNwk2";;;#WeeklyAddress;"918960024256434176";https://twitter.com/realDonaldTrump/status/918960024256434176
realDonaldTrump;2017-10-13 14:09;17532;66065;"Today, I announced our strategy to confront the Iranian regime’s hostile actions and to ensure that they never acquire a nuclear weapon. pic.twitter.com/N4ISdjuEdC";;;;"918901399080935424";https://twitter.com/realDonaldTrump/status/918901399080935424
realDonaldTrump;2017-10-13 13:41;11337;48233;""Consumer confidence soars to highest level since 2004" http:// 45.wh.gov/ConsumerConfid ence … pic.twitter.com/U8MS9K45fX";;;;"918894502185787392";https://twitter.com/realDonaldTrump/status/918894502185787392
realDonaldTrump;2017-10-13 13:07;20981;79398;"In America, we don't worship government - we worship God. #ValuesVotersSummit pic.twitter.com/YQ3iDlWylK";;;#ValuesVotersSummit;"918885859230875649";https://twitter.com/realDonaldTrump/status/918885859230875649
realDonaldTrump;2017-10-13 12:30;16549;72557;"I have no greater privilege than to serve as your Commander-in-Chief. HAPPY BIRTHDAY to the incredible men and women @USNavy ! #242NavyBday pic.twitter.com/qcdB4U8CqA";;@USNavy;#242NavyBday;"918876603148652544";https://twitter.com/realDonaldTrump/status/918876603148652544
realDonaldTrump;2017-10-13 08:01;11902;63007;"The wonderful people of Puerto Rico, with their unmatched spirit, know how bad things were before the H's. I will always be with them!";;;;"918808798059483136";https://twitter.com/realDonaldTrump/status/918808798059483136
realDonaldTrump;2017-10-13 07:51;22671;92313;"Hard to believe that the Democrats, who have gone so far LEFT that they are no longer recognizable, are fighting so hard for Sanctuary crime";;;;"918806396875010048";https://twitter.com/realDonaldTrump/status/918806396875010048
realDonaldTrump;2017-10-13 07:14;15434;75774;"ObamaCare is a broken mess. Piece by piece we will now begin the process of giving America the great HealthCare it deserves!";;;;"918797009133465600";https://twitter.com/realDonaldTrump/status/918797009133465600
realDonaldTrump;2017-10-13 07:10;11845;51475;"Sadly, they and others are Fake News, and the public is just beginning to figure it out! https:// twitter.com/billoreilly/st atus/918502669131579392 …";;;;"918796079243677696";https://twitter.com/realDonaldTrump/status/918796079243677696
realDonaldTrump;2017-10-13 05:36;14155;63822;"The Democrats ObamaCare is imploding. Massive subsidy payments to their pet insurance companies has stopped. Dems should call me to fix!";;;;"918772522983874561";https://twitter.com/realDonaldTrump/status/918772522983874561
realDonaldTrump;2017-10-12 21:18;16419;68299;"It is time to take care of OUR COUNTRY, to rebuild OUR COMMUNITIES, and to protect our GREAT AMERICAN WORKERS! #TaxReform pic.twitter.com/FEjGjT4xp9";;;#TaxReform;"918647067224035334";https://twitter.com/realDonaldTrump/status/918647067224035334
realDonaldTrump;2017-10-12 20:12;22371;87413;"People are just now starting to find out how dishonest and disgusting (FakeNews) @NBCNews is. Viewers beware. May be worse than even @CNN !";;@NBCNews @CNN;;"918630610167529472";https://twitter.com/realDonaldTrump/status/918630610167529472
realDonaldTrump;2017-10-12 16:19;10956;49866;"Happy #NationalFarmersDay ! https:// instagram.com/p/BaKTq11AF3n/ pic.twitter.com/QbUG1pztaI";;;#NationalFarmersDay;"918571860308254720";https://twitter.com/realDonaldTrump/status/918571860308254720
realDonaldTrump;2017-10-12 14:17;15566;67927;"We need a tax system that is FAIR to working FAMILIES & that encourages companies to STAY in AMERICA, GROW in AMERICA, and HIRE in AMERICA! pic.twitter.com/DdI1yWi7YZ";;;;"918541193037967361";https://twitter.com/realDonaldTrump/status/918541193037967361
realDonaldTrump;2017-10-12 13:06;12842;51796;"The time has come to take action to IMPROVE access, INCREASE choices, and LOWER COSTS for HEALTHCARE! http:// 45.wh.gov/Sp9y4H pic.twitter.com/dDZLsKuNSe";;;;"918523263554412544";https://twitter.com/realDonaldTrump/status/918523263554412544
realDonaldTrump;2017-10-12 08:45;16909;80336;"The Fake News Is going all out in order to demean and denigrate! Such hatred!";;;;"918457595618365441";https://twitter.com/realDonaldTrump/status/918457595618365441
realDonaldTrump;2017-10-12 07:07;13432;64790;"...We cannot keep FEMA, the Military & the First Responders, who have been amazing (under the most difficult circumstances) in P.R. forever!";;;;"918432809282342912";https://twitter.com/realDonaldTrump/status/918432809282342912
realDonaldTrump;2017-10-12 06:58;10157;50720;"...accountability say the Governor. Electric and all infrastructure was disaster before hurricanes. Congress to decide how much to spend....";;;;"918430769776914432";https://twitter.com/realDonaldTrump/status/918430769776914432
realDonaldTrump;2017-10-12 06:49;10195;47206;""Puerto Rico survived the Hurricanes, now a financial crisis looms largely of their own making." says Sharyl Attkisson. A total lack of.....";;;;"918428456869916672";https://twitter.com/realDonaldTrump/status/918428456869916672
realDonaldTrump;2017-10-12 06:04;6720;37548;"Clips from tax speech and @seanhannity on @foxandfriends now. Have a great day!";;@seanhannity @foxandfriends;;"918417002733154305";https://twitter.com/realDonaldTrump/status/918417002733154305
realDonaldTrump;2017-10-11 20:40;13495;60519;"In even the darkest moments, the light of our people has shown through their goodness, their courage and their love. #USA pic.twitter.com/8JK8aM2a1L";;;#USA;"918275261011038210";https://twitter.com/realDonaldTrump/status/918275261011038210
realDonaldTrump;2017-10-11 20:09;20365;87750;"Network news has become so partisan, distorted and fake that licenses must be challenged and, if appropriate, revoked. Not fair to public!";;;;"918267396493922304";https://twitter.com/realDonaldTrump/status/918267396493922304
realDonaldTrump;2017-10-11 19:56;5604;31594;"Joining @SeanHannity tonight at 9pmE on @FoxNews . Enjoy! pic.twitter.com/RCfiJus5Rw";;@SeanHannity @FoxNews;;"918263984029085697";https://twitter.com/realDonaldTrump/status/918263984029085697
realDonaldTrump;2017-10-11 19:28;12263;56458;"We need a tax system that is FAIR to working families & that encourages companies to STAY in America, GROW in America, and HIRE in America pic.twitter.com/u9ZgijgLE3";;;;"918257107182473216";https://twitter.com/realDonaldTrump/status/918257107182473216
realDonaldTrump;2017-10-11 17:32;10404;57773;"I will be interviewed tonight on @FoxNews by @SeanHannity at 9pmE. Enjoy!";;@FoxNews @SeanHannity;;"918227740700102657";https://twitter.com/realDonaldTrump/status/918227740700102657
realDonaldTrump;2017-10-11 17:18;5079;27832;"Join me LIVE at 5:45pmE from Harrisburg, Pennsylvania! #TaxReform #USA http:// 45.wh.gov/anNWTR pic.twitter.com/1mMjl1HNpl";;;#TaxReform #USA;"918224393062551552";https://twitter.com/realDonaldTrump/status/918224393062551552
realDonaldTrump;2017-10-11 15:49;19127;113896;"Happy to announce we are awarding $1M to Las Vegas - in order to help local law enforcement working OT to respond to last Sunday’s tragedy.";;;;"918201878479073280";https://twitter.com/realDonaldTrump/status/918201878479073280
realDonaldTrump;2017-10-11 09:55;23284;99127;"With all of the Fake News coming out of NBC and the Networks, at what point is it appropriate to challenge their License? Bad for country!";;;;"918112884630093825";https://twitter.com/realDonaldTrump/status/918112884630093825
realDonaldTrump;2017-10-11 09:45;18971;73729;"Fake @NBCNews made up a story that I wanted a "tenfold" increase in our U.S. nuclear arsenal. Pure fiction, made up to demean. NBC = CNN!";;@NBCNews;;"918110279367643137";https://twitter.com/realDonaldTrump/status/918110279367643137
realDonaldTrump;2017-10-11 06:47;20406;105047;"It is about time that Roger Goodell of the NFL is finally demanding that all players STAND for our great National Anthem-RESPECT OUR COUNTRY";;;;"918065431939829760";https://twitter.com/realDonaldTrump/status/918065431939829760
realDonaldTrump;2017-10-11 06:36;19390;84187;"The Democrats want MASSIVE tax increases & soft, crime producing borders.The Republicans want the biggest tax cut in history & the WALL!";;;;"918062778522505216";https://twitter.com/realDonaldTrump/status/918062778522505216
realDonaldTrump;2017-10-11 06:31;15426;74303;"It would be really nice if the Fake News Media would report the virtually unprecedented Stock Market growth since the election.Need tax cuts";;;;"918061437750267904";https://twitter.com/realDonaldTrump/status/918061437750267904
realDonaldTrump;2017-10-11 06:26;11209;54841;"...if Congress gives us the massive tax cuts (and reform) I am asking for, those numbers will grow by leaps and bounds. #MAGA";;;#MAGA;"918060313748164608";https://twitter.com/realDonaldTrump/status/918060313748164608
realDonaldTrump;2017-10-11 06:21;18194;79234;"Stock Market has increased by 5.2 Trillion dollars since the election on November 8th, a 25% increase. Lowest unemployment in 16 years and..";;;;"918058910673760258";https://twitter.com/realDonaldTrump/status/918058910673760258
realDonaldTrump;2017-10-10 21:21;15933;77209;"...fired. This story is totally made up by the dishonest media.The Chief is doing a FANTASTIC job for me and, more importantly, for the USA!";;;;"917923131003719681";https://twitter.com/realDonaldTrump/status/917923131003719681
realDonaldTrump;2017-10-10 21:15;16058;69446;"The Fake News is at it again, this time trying to hurt one of the finest people I know, General John Kelly, by saying he will soon be.....";;;;"917921548677328896";https://twitter.com/realDonaldTrump/status/917921548677328896
realDonaldTrump;2017-10-10 19:29;14142;66077;"My great honor to host the 2017 back-to-back #StanleyCup Champion Pittsburgh Penguins at the WH with @FLOTUS today! https:// instagram.com/p/BaFfIqFgSDQ/ pic.twitter.com/rBwGmhMnPX";;@FLOTUS;#StanleyCup;"917894963832246272";https://twitter.com/realDonaldTrump/status/917894963832246272
realDonaldTrump;2017-10-10 08:50;14670;62403;"The Failing @nytimes set Liddle' Bob Corker up by recording his conversation. Was made to sound a fool, and that's what I am dealing with!";;@nytimes;;"917734186848579584";https://twitter.com/realDonaldTrump/status/917734186848579584
realDonaldTrump;2017-10-10 08:13;11411;58321;"Highly respected author, Christopher Bedford, just came out with book, "The Art of the Donald, Lessons from America's...." Really good book!";;;;"917724872905777155";https://twitter.com/realDonaldTrump/status/917724872905777155
realDonaldTrump;2017-10-10 06:42;20211;95650;"With Jemele Hill at the mike, it is no wonder ESPN ratings have "tanked," in fact, tanked so badly it is the talk of the industry!";;;;"917701841466593280";https://twitter.com/realDonaldTrump/status/917701841466593280
realDonaldTrump;2017-10-10 06:30;22622;99712;"Since Congress can't get its act together on HealthCare, I will be using the power of the pen to give great HealthCare to many people - FAST";;;;"917698839846576130";https://twitter.com/realDonaldTrump/status/917698839846576130
realDonaldTrump;2017-10-10 06:18;22240;86777;"The problem with agreeing to a policy on immigration is that the Democrats don't want secure borders,they don't care about safety for U.S.A.";;;;"917695847063805952";https://twitter.com/realDonaldTrump/status/917695847063805952
realDonaldTrump;2017-10-10 06:13;32467;138454;"Why is the NFL getting massive tax breaks while at the same time disrespecting our Anthem, Flag and Country? Change tax law!";;;;"917694644481413120";https://twitter.com/realDonaldTrump/status/917694644481413120
realDonaldTrump;2017-10-09 21:51;34563;166179;"A big salute to Jerry Jones, owner of the Dallas Cowboys, who will BENCH players who disrespect our Flag."Stand for Anthem or sit for game!"";;;;"917568245854605313";https://twitter.com/realDonaldTrump/status/917568245854605313
realDonaldTrump;2017-10-09 14:35;16498;69220;""President Donald J. Trump Proclaims October 9, 2017, as #ColumbusDay " https://www. whitehouse.gov/the-press-offi ce/2017/10/06/president-donald-j-trump-proclaims-october-9-2017-columbus-day …";;;#ColumbusDay;"917458408927842305";https://twitter.com/realDonaldTrump/status/917458408927842305
realDonaldTrump;2017-10-09 07:05;20788;109363;"The trip by @VP Pence was long planned. He is receiving great praise for leaving game after the players showed such disrespect for country!";;@VP;;"917345200414035969";https://twitter.com/realDonaldTrump/status/917345200414035969
realDonaldTrump;2017-10-09 06:50;21473;107650;"Our country has been unsuccessfully dealing with North Korea for 25 years, giving billions of dollars & getting nothing. Policy didn't work!";;;;"917341511754436609";https://twitter.com/realDonaldTrump/status/917341511754436609
realDonaldTrump;2017-10-08 19:58;14647;75665;""The Republican Party is racking up record amounts of small dollar donations - fueled by Trump supporters....." @nypost Thank you!";;@nypost;;"917177470532636672";https://twitter.com/realDonaldTrump/status/917177470532636672
